{
  "id": "LZMA-exception",
  "kind": "exception",
  "schemaVersion": "1.0.0",
  "sourceFingerprint": {
    "sourceId": "spdx-exception-list",
    "revision": "manifest-sha256:74897699de0d23c4da42b94bf46bc6fd01f7b68ffcece9db1a98194ac277bb02",
    "contentHash": "sha256:88459449b50996c83c8dd09838e4a17817bb0529d751f946b1d149c70b009564"
  },
  "review": {
    "status": "pending",
    "recommendable": false,
    "evidenceLevel": "weak"
  },
  "semantic": {
    "exceptionApplicability": "conditional",
    "permissions": [
      "unknown"
    ],
    "triggers": [
      "combination"
    ],
    "restrictions": [
      "unknown"
    ]
  },
  "evidence": [
    {
      "field": "exceptionApplicability",
      "sourceId": "spdx-exception-list",
      "locator": "text",
      "ruleId": "lic-007.exception-scope",
      "ruleVersion": "lic-007-v1"
    },
    {
      "field": "triggers",
      "sourceId": "spdx-exception-list",
      "locator": "text",
      "ruleId": "lic-007.exception-combination",
      "ruleVersion": "lic-007-v1"
    }
  ]
}
