{
  "id": "GPL-3.0-389-ds-base-exception",
  "kind": "exception",
  "schemaVersion": "1.0.0",
  "sourceFingerprint": {
    "sourceId": "spdx-exception-list",
    "revision": "manifest-sha256:74897699de0d23c4da42b94bf46bc6fd01f7b68ffcece9db1a98194ac277bb02",
    "contentHash": "sha256:ffd9d870189463ef8f2684ec729d8c3176b3ad170cc55a38966649f8638649e5"
  },
  "review": {
    "status": "pending",
    "recommendable": false,
    "evidenceLevel": "unknown"
  },
  "semantic": {
    "exceptionApplicability": "unknown",
    "permissions": [
      "unknown"
    ],
    "triggers": [
      "unknown"
    ],
    "restrictions": [
      "unknown"
    ]
  },
  "evidence": []
}
