{
  "id": "Universal-FOSS-exception-1.0",
  "kind": "exception",
  "schemaVersion": "1.0.0",
  "sourceFingerprint": {
    "sourceId": "spdx-exception-list",
    "revision": "manifest-sha256:74897699de0d23c4da42b94bf46bc6fd01f7b68ffcece9db1a98194ac277bb02",
    "contentHash": "sha256:882180980dc2485d6645195986098e2edf2c24334650ab7d132d46b0bbd8f293"
  },
  "review": {
    "status": "pending",
    "recommendable": false,
    "evidenceLevel": "unknown"
  },
  "semantic": {
    "exceptionApplicability": "unknown",
    "permissions": [
      "unknown"
    ],
    "triggers": [
      "unknown"
    ],
    "restrictions": [
      "unknown"
    ]
  },
  "evidence": []
}
