{
  "id": "kvirc-openssl-exception",
  "kind": "exception",
  "schemaVersion": "1.0.0",
  "sourceFingerprint": {
    "sourceId": "spdx-exception-list",
    "revision": "manifest-sha256:74897699de0d23c4da42b94bf46bc6fd01f7b68ffcece9db1a98194ac277bb02",
    "contentHash": "sha256:8ae6cd759613d873062bb767f1ac261f1e792c55a31846da2cb35ba69b307be4"
  },
  "review": {
    "status": "pending",
    "recommendable": false,
    "evidenceLevel": "unknown"
  },
  "semantic": {
    "exceptionApplicability": "unknown",
    "permissions": [
      "unknown"
    ],
    "triggers": [
      "unknown"
    ],
    "restrictions": [
      "unknown"
    ]
  },
  "evidence": []
}
